structure,structure_title,chain_length,chain_organism,chain_title,suggested_name,model_length,bit_score,cutoff_score,e_value,suggested_accession
3j0o_a,Core of mammalian 80S pre-ribosome in complex with tRNAs fitted to a 9A cryo-EM map: classic PRE state 2,48,,40S ribosomal RNA fragment,SSU_rRNA_eukarya,1831,47.6,50.00,3.7e-13,RF01960
5une_B,Dimerized Structure Gives Further Insight Into the Function of the Novel RNA Gene: HAR1,47,Homo sapiens,RNA (47-MER),HAR1A,118,26.1,40.00,8.7e-07,RF00635
8asw_X,Cryo-EM structure of yeast Elp123 in complex with alanine tRNA,73,,Alanine tRNA,tRNA,71,62.9,29.00,9.4e-15,RF00005
1t1m_B,Binding position of ribosome recycling factor (RRF) on the E. coli 70S ribosome,42,Escherichia coli,42-mer fragment of double helix from 16S rRNA,SSU_rRNA_bacteria,1533,17.8,50.00,0.00018,RF00177
5w1h_B,Crystal structure of LbaCas13a (C2c2) bound to mature crRNA (24-nt spacer),52,Lachnospiraceae bacterium,mature crRNA,CRISPR-DR32,37,10.3,48.00,10.0,RF01342
5fj4_H,Structure of the standard kink turn HmKt-7 as stem loop bound with U1A and L7Ae proteins,35,,HMKT-7,U1,166,5.8,66.00,2.4,RF00003
5o7h_A,Structure of the Cascade-I-Fv complex from Shewanella putrefaciens,43,,crRNA,CRISPR-DR4,28,30.2,35.00,3.5e-06,RF01317
1c9s_W,CRYSTAL STRUCTURE OF A COMPLEX OF TRP RNA-BINDING ATTENUATION PROTEIN WITH A 53-BASE SINGLE STRANDED RNA CONTAINING ELEVEN GAG TRIPLETS SEPARATED BY AU DINUCLEOTIDES,55,Geobacillus stearothermophilus,SINGLE STRANDED RNA (55-MER),MIR1886,54,10.9,62.00,3.1,RF03803
8gs2_D,Structure of the Cas7-11-Csx29-guide RNA-target RNA (non-matching PFS) complex,33,,target RNA with non-matching PFS,MS2,36,18.8,40.00,0.0015,RF02359
7jnh_B,Crystal structure of a double-ENE RNA stability element in complex with a 28-mer poly(A) RNA,86,Oryza sativa,"Core double ENE RNA (Xtal construct) from Oryza sativa transposon,Core double ENE RNA (Xtal construct) from Oryza sativa transposon",MIR821,275,8.0,166.00,4.0,RF00885
3bo0_G,Ribosome-SecY complex,32,,23S ribosomal RNA,sR5,53,8.1,40.00,1.2,RF01304
4by9_A,The structure of the Box CD enzyme reveals regulation of rRNA methylation,72,,SSR26,snoPyro_CD,58,23.3,45.00,0.00092,RF00095
1g1x_D,"STRUCTURE OF RIBOSOMAL PROTEINS S15, S6, S18, AND 16S RIBOSOMAL RNA",41,,16S ribosomal RNA,Sarbecovirus-5UTR,298,3.4,150.00,8.3,RF03120
3ep2_B,Model of Phe-tRNA(Phe) in the ribosomal pre-accommodated state revealed by cryo-EM,48,,Fragment H43-44 of the 23S rRNA,LSU_rRNA_bacteria,2925,46.0,50.00,3.2e-14,RF02541
7y81_B,CryoEM structure of type III-E CRISPR Craspase gRAMP-crRNA complex bound to non-self RNA target,110,Candidatus Scalindua brodae,crRNA,mir-7578,82,15.6,60.00,0.24,RF03775
2mhi_A,Solution structure of the CR4/5 domain of medaka telomerase RNA,53,,Medaka telomerase RNA,Telomerase-vert,436,25.0,70.00,1.5e-05,RF00024
5k7d_A,"The structure of native pistol ribozyme, bound to Iridium",47,synthetic construct,RNA 47-MER,Pistol,70,33.8,34.00,2.6e-06,RF02679
4cxg_a,Regulation of the mammalian elongation cycle by 40S subunit rolling: a eukaryotic-specific ribosome rearrangement,48,,18S RRNA - H5-H14,SSU_rRNA_eukarya,1831,41.2,50.00,3.3e-11,RF01960
7lhd_A,The complete model of phage Qbeta virion,4217,,Genomic RNA,mir-2076,68,21.7,90.00,0.28,RF04036
2oiu_Q,L1 Ribozyme Ligase circular adduct,71,,L1 Ribozyme RNA Ligase,Transposase-2,69,8.4,42.70,5.4,RF03015
3x1l_I,Crystal Structure of the CRISPR-Cas RNA Silencing Cmr Complex Bound to a Target Analog,39,,RNA (32-MER),CRISPR-DR6,30,10.2,39.00,3.4,RF01319
5u30_B,Crystal structure of AacC2c1-sgRNA-extended target DNA ternary complex,112,Alicyclobacillus acidoterrestris,sgRNA,mir-4880,75,14.7,100.00,0.61,RF04008
7jrr_A,Crystal structures of artificially designed homomeric RNA nanoarchitectures,51,synthetic construct,RNA (50-MER),psaA,195,5.9,50.00,5.3,RF01752
6vrb_B,Cryo-EM structure of AcrVIA1-Cas13(crRNA) complex,52,,RNA (52-MER),CRISPR-DR10,37,8.5,39.00,8.9,RF01323
4mgn_A,Co-crystal structure of the G. kaustophilus glyQS T box riboswitch Stem I in complex with tRNA,86,Geobacillus kaustophilus,glyQS T box riboswitch,SpR19_sRNA,123,11.2,79.00,3.3,RF02447
8a22_B2,Structure of the mitochondrial ribosome from Polytomella magna,214,,mtSSU-2,SSU_rRNA_bacteria,1533,28.3,50.00,3.8e-07,RF00177
3j46_3,Structure of the SecY protein translocation channel in action,44,,23S ribosomal RNA,CRISPR-DR10,37,10.6,39.00,1.8,RF01323
6iv6_G,Cryo-EM structure of AcrVA5-acetylated MbCas12a in complex with crRNA,59,synthetic construct,RNA (59-MER),mir-223,106,9.8,57.00,1.5,RF00664
6vyt_7,"Escherichia coli transcription-translation complex A2 (TTC-A2) containing a 15 nt long mRNA spacer, NusG, and fMet-tRNAs at P-site and E-site",32,,mRNA with a 15 nt long spacer,ceN106,77,7.9,60.00,8.5,RF01526
1qzw_F,Crystal structure of the complete core of archaeal SRP and implications for inter-domain communication,47,Saccharolobus solfataricus,7S RNA,Archaea_SRP,318,33.8,89.00,1.5e-07,RF01857
8btz_A,Single-stranded Paranemic Crossover RNA Triangle (PXT),238,synthetic construct,RNA Paranemic croosover triangle (PXT),mtPerm-5S,106,31.4,39.00,0.00033,RF02547
7elh_S,In situ structure of transcriptional enzyme complex and capsid shell protein of mammalian reovirus at initiation state,60,,RNA (60-MER),mir-297,71,11.6,90.00,4.4,RF04217
6z1p_Aa,Structure of the mitochondrial ribosome from Tetrahymena thermophila,278,,LSU rRNA_1,LSU_rRNA_bacteria,2925,33.7,50.00,2.4e-09,RF02541
7jrs_A,Crystal structures of artificially designed homomeric RNA nanoarchitectures,129,synthetic construct,RNA 3D nanocage,Actinomyces-1,110,14.2,39.10,1.8,RF02928
4x4n_D,Crystal structure of the A.fulgidus CCA-adding enzyme in complex with a G70A arginyl-tRNA minihelix,32,Homo sapiens,G70A tRNA minihelix,tRNA,71,14.1,29.00,0.17,RF00005
8apn_C1,Structure of the mitochondrial ribosome from Polytomella magna with tRNA bound to the P site,73,,P-site tRNA,tRNA,71,64.6,29.00,3e-15,RF00005
1g1x_I,"STRUCTURE OF RIBOSOMAL PROTEINS S15, S6, S18, AND 16S RIBOSOMAL RNA",41,,16S ribosomal RNA,Sarbecovirus-5UTR,298,3.4,150.00,8.3,RF03120
4ts2_Y,"Crystal structure of the Spinach RNA aptamer in complex with DFHBI, magnesium ions",47,synthetic construct,"Spinach aptamer RNA, bimolecular construct",mir-2766,68,14.0,60.00,0.25,RF03970
7s7b_H,Human Nuclear exosome targeting (NEXT) complex homodimer bound to RNA (substrate 1),46,,RNA (46-MER),MS2,36,25.9,40.00,2.1e-05,RF02359
4zc7_B,Paromomycin bound to a leishmanial ribosomal A-site,92,synthetic construct,RNA duplex,naRNA4,77,25.1,59.50,0.0019,RF02564
6ydp_AV,55S mammalian mitochondrial ribosome with mtEFG1 and P site fMet-tRNAMet (POST),71,,fMet-tRNAMet (P site),tRNA,71,25.9,29.00,0.0002,RF00005
6tqn_R,rrn anti-termination complex without S4,85,,rrnGnut,Ysr197,254,25.7,167.00,1.9e-05,RF02849
