structure,structure_title,chain_length,chain_organism,chain_title,suggested_name,model_length,bit_score,cutoff_score,e_value,suggested_accession
5jup_EC,"Saccharomyces cerevisiae 80S ribosome bound with elongation factor eEF2-GDP-sordarin and Taura Syndrome Virus IRES, Structure II (mid-rotated 40S subunit)",201,,IRES,Cyano-1,69,17.4,41.00,0.36,RF01701
1s03_A,The Structure of a Ribosomal Protein S8/spc Operon mRNA Complex,47,Escherichia coli,47-MER,queA,59,8.8,52.60,3.3,RF03093
6xn5_R,Structure of the Lactococcus lactis Csm Apo- CRISPR-Cas Complex,32,,Crispr RNA,freshwater-1,62,7.2,72.00,8.6,RF02979
1cql_A,NMR STRUCTURE OF SRP RNA DOMAIN IV,43,Escherichia coli,SRP DOMAIN IV RNA,Bacteria_small_SRP,97,34.2,40.00,3.9e-07,RF00169
2om7_G,Structural Basis for Interaction of the Ribosome with the Switch Regions of GTP-bound Elongation Factors,54,,Fragment of23S rRNA (H68),LSU_rRNA_bacteria,2925,36.2,50.00,6.6e-11,RF02541
5eeu_W,RADIATION DAMAGE TO THE TRAP-RNA COMPLEX: DOSE (DWD) 1.31 MGy,55,synthetic construct,(GAGUU)10GAG 53-NUCLEOTIDE RNA,mir-1017,71,9.2,50.00,7.2,RF02517
2om7_H,Structural Basis for Interaction of the Ribosome with the Switch Regions of GTP-bound Elongation Factors,42,,Fragment of23S rRNA (H89),LSU_rRNA_bacteria,2925,27.7,50.00,3.7e-08,RF02541
7n0c_T,Cryo-EM structure of the monomeric form of SARS-CoV-2 nsp10-nsp14 (E191A)-RNA complex,37,,RNA (25-MER),Sarbecovirus-3UTR,335,21.1,179.70,2.3e-05,RF03125
6bhj_E,Structure of HIV-1 Reverse Transcriptase Bound to a 38-mer Hairpin Template-Primer RNA-DNA Aptamer,38,,38-MER RNA-DNA Aptamer,mir-3130,75,19.4,95.00,0.016,RF03736
2n3q_A,NMR structure of the II-III-VI three-way junction from the VS ribozyme,62,synthetic construct,RNA (62-MER),HDV-F-prausnitzii,74,9.3,44.00,4.0,RF02682
6pij_1,"Target DNA-bound V. cholerae TniQ-Cascade complex, closed conformation",60,,guide RNA,CRISPR-DR4,28,10.3,35.00,6.5,RF01317
8a22_A9,Structure of the mitochondrial ribosome from Polytomella magna,69,,mt-5S,MIR9666,98,9.6,88.00,9.7,RF03465
4v5z_AH,Structure of a mammalian 80S ribosome obtained by docking homology models of the RNA and proteins into an 8.7 A cryo-EM map,41,,RNA helix,RsmY,121,8.7,57.00,0.53,RF00195
1r7z_A,"NMR STRUCTURE OF THE R(GGAGGACAUUCCUCACGGGUGACCGUGGUCCUCC), DOMAIN IV STEM-LOOP B OF ENTEROVIRAL IRES WITH AUUCCU BULGE",34,,34-MER,RAGATH-31,54,11.5,71.80,1.9,RF03101
3vjr_B,Crystal structure of Peptidyl-tRNA hydrolase from Escherichia coli in complex with the CCA-acceptor-T[PSI]C domain of tRNA,36,Escherichia coli K-12,tRNA CCA-acceptor,cyano_tmRNA,288,16.8,70.00,0.00055,RF01851
1mnx_A,The Solution Structure of the Loop E Region of the 5S rRNA from Spinach Chloroplasts.,42,Spinacia oleracea,Loop E from 5S rRNA,SBWMV2_UPD-PKb,29,8.9,39.00,6.2,RF01104
8a22_A1,Structure of the mitochondrial ribosome from Polytomella magna,109,,mtLSU-1,RAGATH-17,96,13.6,102.30,8.9,RF03095
7k16_P,Tamana Bat Virus xrRNA1,51,Tamana bat virus,RNA (51-MER),Flavi_ISFV_repeat_Ra_Rb,100,18.7,50.00,0.054,RF03542
6zj3_LN,Cryo-EM structure of the highly atypical cytoplasmic ribosome of Euglena gracilis,86,,LSU rRNA chain 13,mir-939,82,12.6,84.00,3.6,RF00981
7ljy_B,Cryo-EM structure of the B dENE construct complexed with a 28-mer poly(A),76,Oryza sativa,B dENE construct,mir-3130,75,13.4,95.00,1.2,RF03736
2mxl_A,Structural features of a 3' splice site in influenza A: 39-nt hairpin,39,synthetic construct,RNA (39-MER),skipping-rope,85,8.3,36.70,6.4,RF02924
8gs2_R,Structure of the Cas7-11-Csx29-guide RNA-target RNA (non-matching PFS) complex,95,,crRNA,bantam,82,14.3,55.00,1.1,RF00727
7q4k_D2,Erythromycin-stalled Escherichia coli 70S ribosome with streptococcal MsrDL nascent chain,77,,Met-tRNA (P site),tRNA,71,69.6,29.00,1.3e-16,RF00005
3j45_4,Structure of a non-translocating SecY protein channel with the 70S ribosome,61,,23S ribosomal RNA,LSU_rRNA_bacteria,2925,35.5,50.00,1.3e-10,RF02541
2i7z_B,GAAA tetraloop receptor complex with associated manganese ions.,43,,43-MER,ncr1015,121,16.3,60.00,0.66,RF02449
1u3k_A,The solution structure of a substrate of archaeal pre-tRNA splicing endonucleases,38,,ABISS7,DUF3800-XI,48,8.3,37.80,1.7,RF02975
3jcs_3,2.8 Angstrom cryo-EM structure of the large ribosomal subunit from the eukaryotic parasite Leishmania,213,,26S gamma ribosomal RNA,SNORD42,68,14.8,39.00,4.5,RF00150
7cyq_I,Cryo-EM structure of an extended SARS-CoV-2 replication and transcription complex reveals an intermediate state in cap synthesis,33,,Primer,MIR528,89,11.5,62.00,0.85,RF04083
3lqx_B,SRP ribonucleoprotein core complexed with cobalt hexammine,49,Escherichia coli,SRP RNA,Bacteria_small_SRP,97,33.7,40.00,6.1e-07,RF00169
6pmo_A,Co-crystal structure of the Geobacillus kaustophilus glyQ T-box riboswitch discriminator domain in complex with tRNA-Gly,66,Geobacillus kaustophilus,T-box riboswitch discriminator,T-box,224,34.8,93.00,2e-07,RF00230
6ltu_B,Crystal structure of Cas12i2 ternary complex with double Mg2+ bound in catalytic pocket,58,synthetic construct,RNA (56-mer),mir-1912,77,11.6,72.00,1.8,RF02017
8ea4_7,"V-K CAST Transpososome from Scytonema hofmanni, minor configuration",265,,sg_RNA,sroH,161,8.5,80.00,3.6,RF00372
7krp_T,Structure of SARS-CoV-2 backtracked complex complex bound to nsp13 helicase - BTC (local refinement),55,,RNA (36-MER),Sarbecovirus-3UTR,335,32.9,179.70,7.5e-09,RF03125
1duh_A,CRYSTAL STRUCTURE OF THE CONSERVED DOMAIN IV OF E. COLI 4.5S RNA,45,,4.5S RNA DOMAIN IV,Bacteria_small_SRP,97,36.4,40.00,9.6e-08,RF00169
7elh_T,In situ structure of transcriptional enzyme complex and capsid shell protein of mammalian reovirus at initiation state,60,,RNA (60-MER),mir-297,71,11.6,90.00,4.4,RF04217
1pn7_C,"Coordinates of S12, L11 proteins and P-tRNA, from the 70S X-ray structure aligned to the 70S Cryo-EM map of E.coli ribosome",62,,P-tRNA,TB6Cs1H3,64,13.1,40.00,0.74,RF01547
2n6x_A,NMR Assignment and structure of CssA5 (middle region) of CssA thermometer from Neisseria meningitidis,43,Neisseria meningitidis,RNA (43-MER),HIV-1_SD,19,10.2,30.00,5.1,RF01380
1g1x_E,"STRUCTURE OF RIBOSOMAL PROTEINS S15, S6, S18, AND 16S RIBOSOMAL RNA",44,,16S ribosomal RNA,weev_FSE,27,12.4,40.00,3.6,RF01836
4pr6_B,A Second Look at the HDV Ribozyme Structure and Dynamics.,144,Homo sapiens,HDV RIBOZYME SELF-CLEAVED,HDV_ribozyme,91,38.9,50.00,0.00015,RF00094
6e9e_B,EsCas13d-crRNA binary complex,51,bacterium,crRNA (52-MER),SNORD56,71,12.9,36.00,0.81,RF00275
6sdy_B,Solution structure of Staufen1 dsRBD4 - hARF1 SBS dsRNA complex.,34,Homo sapiens,hARF1 SBS dsRNA,PhotoRC-I,44,16.1,45.00,0.0062,RF01716
7pkt_4,Large subunit of the Chlamydomonas reinhardtii mitoribosome,118,,L4 rRNA,LSU_rRNA_bacteria,2925,30.9,50.00,8.7e-09,RF02541
6e9f_B,EsCas13d-crRNA-target RNA ternary complex,52,bacterium,crRNA (52-MER),SNORD56,71,10.9,36.00,2.9,RF00275
4oog_D,Crystal structure of yeast RNase III (Rnt1p) complexed with the product of dsRNA processing,34,,34-mer RNA,MIR4387,109,11.2,84.00,1.5,RF04151
2pcw_A,Solution Structure of an rRNA Substrate Bound to the Pseudouridylation Pocket of a Box H/ACA snoRNA,35,Homo sapiens,U65 box H/ACA snoRNA,SNORA65,127,7.1,70.00,9.0,RF00302
6yl5_I,Crystal structure of the SAM-SAH riboswitch with SAH,35,Roseobacter sp.,"Chains: A,B,C,D,E,F,G,H,I,J,K,L",SAM-SAH,49,37.9,40.00,2.7e-08,RF01727
4qjd_D,Crystal Structure of Twister with the Nucleotide 5'- to the Cleavage Site Disordered at 3.1 A Resolution,47,,Twister RNA sequence,twister-P1,67,37.2,67.20,4.3e-08,RF03160
5nfv_B,Crystal structure of catalytically inactive FnCas12 mutant bound to an R-loop structure containing a pre-crRNA mimic and full-length DNA target,46,synthetic construct,pre-crRNA,malK-II,50,10.2,52.90,4.6,RF03008
7ptl_B,Mature conformer of a 6-helix bundle of RNA with clasp,720,synthetic construct,Chains: B,asX6,93,21.9,50.00,0.12,RF02239
7qqp_A,SpCas9 bound to AAVS1 off-target3 DNA substrate,84,synthetic construct,AAVS1 sgRNA,tracrRNA,91,45.5,74.00,2.7e-07,RF02348
4v8m_BH,High-resolution cryo-electron microscopy structure of the Trypanosoma brucei ribosome,135,Trypanosoma brucei,SHORT RRNA-IV OF THE LARGE RIBOSOMAL SUBUNIT,astro_FSE,55,7.9,70.00,5.2,RF01833
1g1x_J,"STRUCTURE OF RIBOSOMAL PROTEINS S15, S6, S18, AND 16S RIBOSOMAL RNA",44,,16S ribosomal RNA,weev_FSE,27,12.4,40.00,3.6,RF01836
7dmq_C,Cryo-EM structure of LshCas13a-crRNA-anti-tag RNA complex,37,Escherichia coli,Anti-tag target RNA,5_8S_rRNA,154,3.4,42.00,9.4,RF00002
2ktz_A,Inhibitor Induced Structural Change in the HCV IRES Domain IIa RNA,38,Hepacivirus C,HCV IRES Domain IIa RNA,chrB-b,51,13.2,36.50,0.16,RF03086
6w5c_B,Cryo-EM structure of Cas12i(E894A)-crRNA-dsDNA complex,59,Escherichia coli,crRNA,Ysr201,70,10.6,62.00,4.6,RF02853
5h9f_L,Crystal structure of E. coli Cascade bound to a PAM-containing dsDNA target at 2.45 angstrom resolution.,61,,crRNA (61-MER),Chlorobi-1,67,15.7,50.00,0.01,RF01696
7elh_N,In situ structure of transcriptional enzyme complex and capsid shell protein of mammalian reovirus at initiation state,60,,RNA (60-MER),mir-297,71,11.6,90.00,4.4,RF04217
3siv_F,"Structure of a hPrp31-15.5K-U4atac 5' stem loop complex, dimeric form",32,,U4atac snRNA,U4atac,133,24.7,53.00,0.0011,RF00618
2fey_A,The structure of stem loop IV of Tetrahymena telomerase RNA,43,,stem-loop IV of Tetrahymena telomerase RNA,5_8S_rRNA,154,9.6,42.00,0.19,RF00002
4v5z_BI,Structure of a mammalian 80S ribosome obtained by docking homology models of the RNA and proteins into an 8.7 A cryo-EM map,72,,RNA Expansion segment ES15 part I,mir-Ro6-3,72,38.4,79.00,5.7e-06,RF03819
8dk7_C,Crystal structure of theophylline aptamer soaked with TAL2,34,,RNA (34-MER),Hairpin,52,8.4,65.00,4.0,RF00173
8e6w_8,"Escherichia coli Rho-dependent transcription pre-termination complex containing 18 nt long RNA spacer, lambda-tR1 rut RNA, Mg-ADP-BeF3, and NusG; Rho part",60,synthetic construct,lambda-tR1 rut RNA,algC,52,10.4,33.80,4.5,RF02929
6az4_A,RNA hairpin complex with guanosine dinucleotide ligand G(5')ppp(5')G,32,synthetic construct,RNA (32-MER),SNORD105,87,8.5,45.00,7.7,RF00584
6lqs_5A,Cryo-EM structure of 90S small subunit preribosomes in transition states (State D),700,,5' ETS,mir-627,87,20.2,86.00,0.062,RF03831
4v5z_AD,Structure of a mammalian 80S ribosome obtained by docking homology models of the RNA and proteins into an 8.7 A cryo-EM map,42,,RNA Expansion segment ES6 part I,astro_FSE,55,8.3,70.00,1.2,RF01833
6s8b_U,"Cryo-EM structure of the Type III-B Cmr-beta bound to cognate target RNA and AMPPnP, state 1",46,,Cognate target RNA (46-mer),CRISPR-DR12,30,9.3,37.00,7.4,RF01325
2l2j_A,Solution NMR structure of the lower part of the R/G stem loop RNA,42,Homo sapiens,RNA (42-MER),mir-2985-2,81,27.8,67.00,6.8e-05,RF02095
2fdt_A,Solution structure of a conserved RNA hairpin of eel LINE UnaL2,36,,36-mer,UnaL2,54,40.2,55.00,8.1e-08,RF00436
8cti_C,Cryo-EM structure of human METTL1-WDR4-tRNA(Val) complex,73,,tRNA-Val-TAC-2-1,tRNA,71,65.5,29.00,1.7e-15,RF00005
4uyk_R,Crystal structure of a Signal Recognition Particle Alu domain in the elongation arrest conformation,134,,SRP RNA,Archaea_SRP,318,77.3,89.00,1.8e-18,RF01857
6pom_A,Cryo-EM structure of the full-length Bacillus subtilis glyQS T-box riboswitch in complex with tRNA-Gly,169,Bacillus subtilis,T-box GlyQS leader (155-MER),T-box,224,76.5,93.00,8.8e-18,RF00230
7elh_R,In situ structure of transcriptional enzyme complex and capsid shell protein of mammalian reovirus at initiation state,60,,RNA (60-MER),mir-297,71,11.6,90.00,4.4,RF04217
4u7u_L,Crystal structure of RNA-guided immune Cascade complex from E.coli,61,,crRNA,Chlorobi-1,67,15.4,50.00,0.013,RF01696
2lu0_A,NMR solution structure of the kappa-zeta region of S.cerevisiae group II intron ai5(gamma),49,Saccharomyces cerevisiae,RNA (49-MER),ceN108,70,12.8,50.00,0.63,RF01611
5fq5_A,Crystal structure of Cas9-sgRNA-DNA complex solved by native SAD phasing,84,synthetic construct,SGRNA,tracrRNA,91,45.5,74.00,2.7e-07,RF02348
4x4u_G,Crystal structure of the A.fulgidus CCA-adding enzyme in complex with a human MenBeta minihelix ending in CCACC,37,Homo sapiens,human MenBeta minihelix,mascRNA-menRNA,56,23.6,42.00,0.00063,RF01684
7v9e_A,Crystal structure of a methyl transferase ribozyme,68,Homo sapiens,RNA (68-MER),mir-584,97,9.8,62.00,7.9,RF01016
5t5h_E,Structure and assembly model for the Trypanosoma cruzi 60S ribosomal subunit,146,,srRNA1,SNORD42,68,13.3,39.00,6.9,RF00150
1yls_B,Crystal structure of selenium-modified Diels-Alder ribozyme complexed with the product of the reaction between N-pentylmaleimide and covalently attached 9-hydroxymethylanthracene,38,,RNA Diels-Alder ribozyme,ASdes,68,11.6,40.00,0.6,RF01781
7qi4_B,Human mitochondrial ribosome at 2.2 A resolution,73,,mitochondrial tRNAVal,tRNA,71,28.1,29.00,4.9e-05,RF00005
2n3r_A,NMR structure of the II-III-VI three-way junction from the VS ribozyme and identification of magnesium-binding sites using paramagnetic relaxation enhancement,62,Neurospora crassa,RNA (62-MER),HDV-F-prausnitzii,74,9.3,44.00,4.0,RF02682
4v5z_BN,Structure of a mammalian 80S ribosome obtained by docking homology models of the RNA and proteins into an 8.7 A cryo-EM map,78,,RNA Expansion segment ES27,Yfr1,59,8.4,38.00,7.3,RF01116
3pla_G,Crystal structure of a catalytically active substrate-bound box C/D RNP from Sulfolobus solfataricus,40,,C/D guide RNA,SNORD90,111,13.7,41.00,1.6,RF00579
6d3p_A,Crystal structure of an exoribonuclease-resistant RNA from Sweet clover necrotic mosaic virus (SCNMV),45,Sweet clover necrotic mosaic virus,RNA (45-MER),PLRV_xrRNA,57,10.3,32.40,2.9,RF04222
5ml7_B,CRYSTAL STRUCTURE OF L1-STALK FRAGMENT OF 23S rRNA FROM HALOARCULA MARISMORTUI,96,Haloarcula marismortui,23S ribosomal RNA,LSU_rRNA_archaea,2987,44.4,50.00,1.1e-12,RF02540
7re1_T,SARS-CoV-2 replication-transcription complex bound to nsp13 helicase - nsp13(2)-RTC (composite),55,,Template RNA,Sarbecovirus-3UTR,335,32.9,179.70,7.5e-09,RF03125
8a22_A5,Structure of the mitochondrial ribosome from Polytomella magna,142,,mtLSU-5,LSU_rRNA_bacteria,2925,41.3,50.00,3.5e-12,RF02541
7d3j_B,Crystal structure of the Cas12i1 R-loop complex after target DNA cleavage,43,Lachnospiraceae bacterium ND2006,RNA (43-MER),rspL,88,10.3,37.00,8.6,RF01823
4pcj_A,Modifications to toxic CUG RNAs induce structural stability and rescue mis-splicing in Myotonic Dystrophy,35,synthetic construct,trCUG-3('5),c-di-GMP-I,87,10.6,35.00,1.0,RF01051
3r9w_B,Crystal structure of Era in complex with MgGDPNP and nucleotides 1506-1542 of 16S ribosomal RNA,34,Aquifex aeolicus,RNA301,SSU_rRNA_eukarya,1831,25.2,50.00,1.8e-06,RF01960
3j45_2,Structure of a non-translocating SecY protein channel with the 70S ribosome,36,,23S ribosomal RNA,LSU_rRNA_bacteria,2925,14.5,50.00,0.00083,RF02541
1kh6_A,Crystal Structure of an RNA Tertiary Domain Essential to HCV IRES-mediated Translation Initiation.,53,,JIIIabc,IRES_HCV,252,39.4,100.00,1.9e-10,RF00061
5ydt_SA,"Remodeled Utp30 in 90S pre-ribosome (Mtr4-depleted, Enp1-TAP)",64,,"Saccharomyces cerevisiae strain ALI 308 18S ribosomal RNA gene, partial sequence",SSU_rRNA_eukarya,1831,27.5,50.00,6.6e-07,RF01960
8dg7_F,Structural Basis of MicroRNA Biogenesis by Dicer-1 and Its Partner Protein Loqs-PB - complex III,38,,RNA (38-MER),let-7,84,10.1,50.00,3.3,RF00027
5une_A,Dimerized Structure Gives Further Insight Into the Function of the Novel RNA Gene: HAR1,47,Homo sapiens,RNA (47-MER),HAR1A,118,26.1,40.00,8.7e-07,RF00635
1r7w_A,"NMR STRUCTURE OF THE R(GGAGGACAUCCCUCACGGGUGACCGUGGUCCUCC), DOMAIN IV STEM-LOOP B OF ENTEROVIRAL IRES WITH AUCCCU BULGE",34,,34-MER,SBWMV2_UPD-PKk,21,9.3,35.00,3.7,RF01111
7lys_B,Cryo-EM structure of CasPhi-2 (Cas12j) bound to crRNA and DNA,45,Phage #D,crRNA,Antizyme_FSE,59,11.6,40.00,1.2,RF00381
6svs_A,Crystal Structure of U:A-U-rich RNA triple helix with 11 consecutive base triples,77,Homo sapiens,RNA (79-mer),Ref84,87,18.6,52.00,0.66,RF02846
6u79_A,Solution NMR structure of 5' UTR stem loop B from West Nile Virus,37,West Nile virus,5' UTR region stem loop,Flavivirus-5UTR,156,15.2,80.00,0.054,RF03546
5y36_B,Cryo-EM structure of SpCas9-sgRNA-DNA ternary complex,99,Mus musculus,single-guide RNA,tracrRNA,91,62.6,74.00,8.1e-11,RF02348
2n8v_X,"An NMR/SAXS structure of the PKI domain of the honeybee dicistrovirus, Israeli acute paralysis virus (IAPV) IRES",70,Apis mellifera,RNA (70-MER),mir-1537,61,11.8,63.00,2.9,RF03638
7jl3_X,Cryo-EM structure of RIG-I:dsRNA filament in complex with RIPLET PrySpry domain (trimer),42,,dsRNA strand1,snoZ17,71,9.4,44.00,7.1,RF00266
6sdw_B,Solution structure of Staufen1 dsRBD3+4 - hARF1 SBS dsRNA complex.,34,Homo sapiens,hARF1 SBS dsRNA,PhotoRC-I,44,16.1,45.00,0.0062,RF01716
7w0e_D,dmDicer2-LoqsPD-dsRNA Active-dicing status,53,,dsRNA,mir-3165,75,29.7,90.00,0.00013,RF04105
1xhp_A,Solution Structure of the Extended U6 ISL as Observed in the U2/U6 complex from Saccharomyces cerevisiae,32,,U6 snRNA,U6,104,18.1,44.00,0.0029,RF00026
1raw_A,"ATP BINDING RNA APTAMER IN COMPLEX WITH AMP, NMR, 10 STRUCTURES",36,,RNA APTAMER,serC,52,6.0,35.00,7.7,RF00517
2kx8_A,NMR structure of stem-loop 4 from the human 7SK snRNA in complex with arginine,42,Homo sapiens,7SK,7SK,330,34.5,35.00,6.5e-09,RF00100
7ele_G,Cryo-EM structure of Arabidopsis DCL1 in complex with pre-miRNA 166f,89,Arabidopsis thaliana,pre-miRNA 166f,mir-166,126,56.7,60.00,3.1e-14,RF00075
7pkt_2,Large subunit of the Chlamydomonas reinhardtii mitoribosome,86,,L2a rRNA,6A,52,15.4,41.20,0.43,RF02925
7pd3_B,Structure of the human mitoribosomal large subunit in complex with NSUN4.MTERF4.GTPBP7 and MALSU1.L0R8F8.mt-ACP,69,,mt-tRNAVal,tRNA,71,28.1,29.00,4.7e-05,RF00005
4m4o_B,Crystal structure of the aptamer minE-lysozyme complex,59,Gallus gallus,RNA (59-MER),L31-Firmicutes,30,7.9,33.30,7.4,RF03156
7w0c_C,Dicer2-Loqs-PD-dsRNA complex at early-translocation state,52,,RNA (35-MER),mir-3165,75,29.7,90.00,0.00013,RF04105
4kzd_R,Crystal structure of an RNA aptamer in complex with fluorophore and Fab,84,,RNA (84-MER),mir-3145,84,15.0,98.00,0.56,RF03498
2oeu_A,Full-length hammerhead ribozyme with Mn(II) bound,43,,Hammerhead Ribozyme,Hammerhead_1,46,27.6,34.00,1e-05,RF00163
3rw6_H,Structure of nuclear RNA export factor TAP bound to CTE RNA,62,Homo sapiens,constitutive transport element(CTE)of Mason-Pfizer monkey virus RNA,Cobalamin,189,9.5,31.50,0.36,RF00174
6ufg_A,Co-crystal structure of M. tuberculosis ileS T-box in complex with tRNA-3'-OH,166,Mycobacterium tuberculosis,RNA (166-MER),T-box,224,23.2,93.00,0.00049,RF00230
7w0d_C,Dicer2-LoqsPD-dsRNA complex at mid-translocation state,52,,dsRNA,mir-3165,75,29.7,90.00,0.00013,RF04105
8aw3_1,Cryo-EM structure of the TbADAT2/3 deaminase in complex with tRNA,75,,RNA (75-MER),tRNA,71,64.2,29.00,4e-15,RF00005
2nue_C,Crystal structure of RNase III from Aquifex aeolicus complexed with ds-RNA at 2.9-Angstrom Resolution,46,Aquifex aeolicus,46-MER,mir-3122,73,22.3,92.00,0.006,RF03366
2lpt_A,Molecular dynamics re-refinement of domain 5 of the Pylaiella littoralis group II intron,34,,RNA_(34-MER),Intron_gpII,93,39.9,40.00,5.5e-08,RF00029
7dlz_X,Crystal Structure of Methyltransferase Ribozyme,45,synthetic construct,RNA (45-MER),mir-B8,67,10.5,90.00,9.2,RF03890
7oax_A,Crystal structure of the Chili RNA aptamer in complex with DMHBO+,52,synthetic construct,Chili RNA Aptamer,KDPG-aldolase,88,8.8,54.60,5.6,RF03115
5xlp_K,Anti-CRISPR proteins AcrF1/2 bound to Csy surveillance complex with a 20nt spacer crRNA backbone region,48,,crRNA with 20nt spacer sequence,CRISPR-DR4,28,26.9,35.00,4e-05,RF01317
4rbq_A,32 base pair oligo(U) RNA,32,synthetic construct,U-Helix RNA from Trypanosome editing,mir-1252,65,11.8,70.00,2.7,RF03623
5de8_A,"Crystal structure of the complex between human FMRP RGG motif and G-quadruplex RNA, iridium hexammine bound form.",35,synthetic construct,sc1,GlsR17_miR2,63,12.3,84.00,0.54,RF02339
2pcv_A,Solution Structure of an rRNA Substrate Bound to the Pseudouridylation Pocket of a Box H/ACA snoRNA,35,Homo sapiens,U65 Box H/ACA snoRNA,SNORA65,127,7.1,70.00,9.0,RF00302
5xwp_C,Crystal structure of LbuCas13a-crRNA-target RNA ternary complex,59,synthetic construct,RNA (59-MER),CRISPR-DR32,37,13.3,48.00,2.0,RF01342
2oiu_P,L1 Ribozyme Ligase circular adduct,71,,L1 Ribozyme RNA Ligase,Transposase-2,69,8.4,42.70,5.4,RF03015
4v5z_BG,Structure of a mammalian 80S ribosome obtained by docking homology models of the RNA and proteins into an 8.7 A cryo-EM map,48,,RNA Expansion segment ES9,mir-574,77,28.5,80.00,0.0009,RF00929
1i9f_A,STRUCTURAL CHARACTERIZATION OF THE COMPLEX OF THE REV RESPONSE ELEMENT RNA WITH A SELECTED PEPTIDE,34,,REV RESPONSE ELEMENT RNA,RRE,337,8.1,104.00,0.16,RF00036
5f9r_A,Crystal structure of catalytically-active Streptococcus pyogenes CRISPR-Cas9 in complex with single-guided RNA and double-stranded DNA primed for target DNA cleavage,118,Streptococcus pyogenes MGAS8232,RNA (116-MER),tracrRNA,91,73.4,74.00,4.9e-13,RF02348
1p5n_A,Solution Structure of HCV IRES Domain IIb,34,,34-MER,IRES_HCV,252,15.2,100.00,0.0024,RF00061
7qca_S60,Spraguea lophii ribosome,1368,,RNA SSU,SSU_rRNA_microsporidia,1311,1179.1,50.00,0.0,RF02542
8ac0_R,"RNA polymerase at U-rich pause bound to regulatory RNA putL - active, closed clamp state",93,,putL RNA,Ms_AS-1,98,9.4,37.00,3.9,RF02463
7qca_L70,Spraguea lophii ribosome,119,,RNA 5S,5S_rRNA,119,93.6,38.00,1.8e-21,RF00001
7xui_R,Cryo-EM structure of sigma70 bound HK022 putRNA-associated E.coli RNA polymerase elongation complex,122,,RNA (122-mer),rsmX,114,24.8,56.00,0.0016,RF02144
6eri_AB,Structure of the chloroplast ribosome with chl-RRF and hibernation-promoting factor,106,,4.5S ribosomal RNA,LSU_rRNA_bacteria,2925,33.8,50.00,8.2e-10,RF02541
7qca_L50,Spraguea lophii ribosome,2618,,RNA 23S,LSU_rRNA_eukarya,3401,1664.0,50.00,0.0,RF02543
6ydw_AY,55S mammalian mitochondrial ribosome with mtEFG1 and two tRNAMet (TI-POST),71,,tRNAMet,tRNA,71,25.9,29.00,0.0002,RF00005
7qr8_A,SpCas9 bound to PTPRC off-target1 DNA substrate,85,synthetic construct,PTPRC sgRNA,tracrRNA,91,45.5,74.00,2.7e-07,RF02348
2nc1_A,Solution structure of the delta-J-delta-K domain of EMCV IRES,67,synthetic construct,IRES RNA (67-MER),IRES_Picorna_2,462,23.7,50.00,2.3e-06,RF00210
5t16_H,Crystal structure of yeast RNase III (Rnt1p) complexed with a non-hydrolyzable RNA substrate analog,34,,RNA substrate analog,mir-3130,75,13.3,95.00,0.57,RF03736
6p5n_1,Structure of a mammalian 80S ribosome in complex with a single translocated Israeli Acute Paralysis Virus IRES and eRF1,251,,IAPV-IRES,IMES-4,80,15.9,48.00,1.4,RF02037
4plx_A,Crystal structure of the triple-helical stability element at the 3' end of MALAT1,76,Homo sapiens,Core ENE hairpin and A-rich tract from MALAT1,mir-737,63,17.3,60.00,0.48,RF03956
5y7m_D,Crystal structure of PhoRpp38 bound to a K-turn in P12.1 helix,51,Pyrococcus horikoshii OT3,RNA (52-MER),sR60,55,10.9,50.00,0.78,RF01309
7eqg_M,Structure of Csy-AcrIF5,60,,RNA (60-MER),CRISPR-DR4,28,26.9,35.00,5e-05,RF01317
8a22_A4,Structure of the mitochondrial ribosome from Polytomella magna,73,,mtLSU-4,LSU_rRNA_bacteria,2925,20.4,50.00,1.8e-05,RF02541
6w2t_A,Structure of the Cricket Paralysis Virus 5-UTR IRES (CrPV 5-UTR-IRES) bound to the small ribosomal subunit in the closed state (Class 2),377,,CrPV 5'-UTR IRES,KRAS_3UTR,49,21.8,49.00,1.7,RF02584
2jtp_A,Solution Structure of the Frameshift-Inducing RNA Stem-Loop in SIV,34,,SIV17-50 RNA (34-MER),HIV_FS2,45,40.1,44.00,7.4e-09,RF01835
2r8s_R,High resolution structure of a specific synthetic FAB bound to P4-P6 RNA ribozyme domain,159,,P4-P6 RNA RIBOZYME DOMAIN,Intron_gpI,251,39.2,50.00,5.1e-09,RF00028
6dme_A,"ppGpp Riboswitch bound to ppGpp, thallium acetate structure",102,Sulfobacillus acidophilus DSM 10332,ppGpp Riboswitch,ykkC-yxkD,107,32.0,63.00,5.1e-05,RF00442
7eni_B,Crystal structure of cas and anti-cas protein complex,74,,sgRNA (74-MER),IRES_Kv1_4,260,6.0,100.00,6.3,RF00447
4oji_A,Crystal Structure of Twister Ribozyme,54,,RNA (52-MER),twister-P1,67,58.3,67.20,3.1e-14,RF03160
6dn2_Y,CRYSTAL STRUCTURE OF THE FMN RIBOSWITCH BOUND TO BRX1354 SPLIT RNA,56,Fusobacterium nucleatum,RNA (56-MER),FMN,138,46.5,66.20,8.9e-11,RF00050
7b3c_T,Structure of elongating SARS-CoV-2 RNA-dependent RNA polymerase with Remdesivir at position -4 (structure 2),57,,RNA (5'-R(P*UP*CP*AP*CP*UP*UP*GP*CP*GP*UP*AP*G)-3'),mir-4081,51,14.7,70.00,0.61,RF03867
3aoi_U,RNA polymerase-Gfh1 complex (Crystal type 2),32,,RNA (5'-R(*CP*CP*CP*GP*GP*AP*AP*GP*AP*UP*CP*AP*UP*CP*UP*UP*CP*CP*GP*GP*GP*GP*GP*AP*U*GP*CP*GP*GP*CP*GP*G)-3'),His_leader,127,19.2,49.00,0.023,RF00514
5btm_A,Crystal structure of AUUCU repeating RNA that causes spinocerebellar ataxia type 10 (SCA10),55,Homo sapiens,RNA (55-mer),SNORD93,74,11.2,60.00,3.9,RF00606
8d8l_a,Yeast mitochondrial small subunit assembly intermediate (State 3),1713,,15S ribosomal RNA,SSU_rRNA_bacteria,1533,260.2,50.00,1.1e-80,RF00177
1txs_A,STEM-LOOP D OF THE CLOVERLEAF DOMAIN OF ENTEROVIRAL 5'UTR RNA,38,,Enteroviral 5'-UTR,Entero_5_CRE,90,34.3,46.00,1.4e-07,RF00386
7m5o_B,Cryo-EM structure of CasPhi-2 (Cas12j) bound to crRNA,45,Phage #D,crRNA,Antizyme_FSE,59,11.6,40.00,1.2,RF00381
5lzc_x,Structure of SelB-Sec-tRNASec bound to the 70S ribosome in the codon reading state (CR),48,,SECIS mRNA,SECIS_2,55,36.0,70.00,5.7e-07,RF01988
6gaz_AV,Unique features of mammalian mitochondrial translation initiation revealed by cryo-EM. This file contains the 28S ribosomal subunit.,71,,"P-site fMet-tRNAMet, mitochondrial",tRNA,71,25.9,29.00,0.0002,RF00005
2qwy_C,SAM-II riboswitch bound to S-adenosylmethionine,52,,SAM-II riboswitch,SAM_alpha,79,27.7,36.00,1.5e-05,RF00521
4rge_C,Crystal structure of the in-line aligned env22 twister ribozyme,56,synthetic construct,env22 twister ribozyme,twister-P1,67,45.7,67.20,1.5e-10,RF03160
3gs5_C,An all-RNA hairpin ribozyme A38N1dA variant with a product mimic substrate strand,36,,RNA (36-MER),Hairpin,52,33.2,65.00,4.8e-06,RF00173
6dn2_X,CRYSTAL STRUCTURE OF THE FMN RIBOSWITCH BOUND TO BRX1354 SPLIT RNA,54,Fusobacterium nucleatum,RNA RIBOSWITCH,FMN,138,41.3,66.20,2.2e-09,RF00050
